index,timelocation,title,description,where
1,32,,Molestiae laudantium dicta ut pariatur molestias deserunt culpa soluta adipisci omnis,migration
2,22,,Lorem ipsum dolor sit amet consectetur adipisicing elit. Ratione perspiciatis et non laborum,natural
3,8,,Aamet consectetur adipisicing elit. Inventore officiis at dolor qui necessitatibus rerum perferendis omnis soluta. Molestiae laudantium dicta ut pariatur molestias deserunt culpa soluta adipisci omnis,migration
4,45,,"Lorem ipsum dolor sit amet, consectetur adipisicing elit. Voluptates laudantium nihil iste quos enim animi",migration
5,70,,"Lorem ipsum dolor sit amet, consectetur adipisicing elit. Voluptates laudantium nihil iste quos enim animi",migration
6,56,,Molestiae laudantium dicta ut pariatur molestias deserunt culpa soluta adipisci omnis,population
7,0,,Canadian population estimated over 10 million since 1929,population
8,35,,Canadian population reaches 20 million,population
9,67,,Canadian population reaches 30 million,population